{
  "project": "Blog_Writing_Agent",
  "total_scenarios": 5,
  "scenarios": [
    {
      "scenario_id": "M01_BS_001",
      "title": "Navigate to Main Menu",
      "business_objective": "Allow the user to access central navigation options via the main menu interaction.",
      "actor": "User",
      "preconditions": [
        "The application interface is loaded and visible."
      ],
      "steps": [
        "The user locates the main menu element (selector LOC-0004).",
        "The user clicks the main menu interactive element."
      ],
      "expected_result": "The main menu interface is opened, presenting available navigation options.",
      "business_rules": [],
      "traceability": [
        {
          "source_file": "synthetic_brd.md",
          "page_number": null,
          "section": "Clickable Elements (buttons, links)",
          "requirement_id": "REQ-004",
          "jira_story_id": null,
          "confluence_page_id": null,
          "method_name": null
        }
      ],
      "confidence_score": 0.95,
      "module_id": "M01",
      "module_name": "Home",
      "content_hash": "2b987dfbda778e9cc5fbf249bb42f278f9ba64d0055346e0b9e8aaba7f3aac22"
    },
    {
      "scenario_id": "M01_BS_002",
      "title": "Deploy Blog Agent Service",
      "business_objective": "Trigger deployment of the blog agent service or application workflow.",
      "actor": "User",
      "preconditions": [
        "The user is on the application control panel with deploy options active."
      ],
      "steps": [
        "The user locates the deploy interactive element (selector LOC-0003).",
        "The user clicks the deploy button."
      ],
      "expected_result": "The deployment process for the blog agent service is successfully initiated.",
      "business_rules": [],
      "traceability": [
        {
          "source_file": "synthetic_brd.md",
          "page_number": null,
          "section": "Clickable Elements (buttons, links)",
          "requirement_id": "REQ-003",
          "jira_story_id": null,
          "confluence_page_id": null,
          "method_name": null
        }
      ],
      "confidence_score": 0.95,
      "module_id": "M01",
      "module_name": "Home",
      "content_hash": "bed56178ac58b342273e134da326634c64b0698870d46214d1d80dd33f1aae29"
    },
    {
      "scenario_id": "M01_BS_003",
      "title": "Stop Active Process",
      "business_objective": "Halt an active execution or process within the system immediately.",
      "actor": "User",
      "preconditions": [
        "An automated task or blog generation process is currently running."
      ],
      "steps": [
        "The user locates the stop interactive element (selector LOC-0002).",
        "The user clicks the stop button."
      ],
      "expected_result": "The active process or execution is terminated immediately.",
      "business_rules": [],
      "traceability": [
        {
          "source_file": "synthetic_brd.md",
          "page_number": null,
          "section": "Clickable Elements (buttons, links)",
          "requirement_id": "REQ-002",
          "jira_story_id": null,
          "confluence_page_id": null,
          "method_name": null
        }
      ],
      "confidence_score": 0.95,
      "module_id": "M01",
      "module_name": "Home",
      "content_hash": "2c5c83e7a0fd14c175e1855b1b3c03134a50967eb60bc24503b643b1e4690d37"
    },
    {
      "scenario_id": "M01_BS_004",
      "title": "Jump to Section Heading",
      "business_objective": "Enable direct navigation to a specific content heading within the blog view.",
      "actor": "User",
      "preconditions": [
        "The user is viewing a document or page containing structured section heading links."
      ],
      "steps": [
        "The user locates the link to heading interactive element (selector LOC-0008).",
        "The user clicks the heading link."
      ],
      "expected_result": "The viewport navigates directly to the specified section heading.",
      "business_rules": [],
      "traceability": [
        {
          "source_file": "synthetic_brd.md",
          "page_number": null,
          "section": "Clickable Elements (buttons, links)",
          "requirement_id": "REQ-005",
          "jira_story_id": null,
          "confluence_page_id": null,
          "method_name": null
        }
      ],
      "confidence_score": 0.95,
      "module_id": "M01",
      "module_name": "Home",
      "content_hash": "81f84f26acf8c60d474cdb65195a393df9862a95ba1610e55ddbbafe2a195c4e"
    },
    {
      "scenario_id": "M01_BS_005",
      "title": "Interact with Generic UI Element",
      "business_objective": "Trigger targeted interactive UI behavior on element selection.",
      "actor": "User",
      "preconditions": [
        "The target interactive element is displayed on the active page."
      ],
      "steps": [
        "The user identifies the general element with selector LOC-0001.",
        "The user performs a click action on the element."
      ],
      "expected_result": "The system processes the user click and triggers the corresponding element event.",
      "business_rules": [],
      "traceability": [
        {
          "source_file": "synthetic_brd.md",
          "page_number": null,
          "section": "Clickable Elements (buttons, links)",
          "requirement_id": "REQ-001",
          "jira_story_id": null,
          "confluence_page_id": null,
          "method_name": null
        }
      ],
      "confidence_score": 0.95,
      "module_id": "M01",
      "module_name": "Home",
      "content_hash": "96ba874f895de6f476bf9c07f2f4b5d49a4acc916f4f3d91fd74be794b74aee8"
    }
  ],
  "modules": [
    "M01"
  ]
}